section,department,strategic_pillar,production,metric,question_id,question_text,response_type,options,required,display_order,kpi_type,ai_weight,depends_on,strategic_objectives_id
Enrollment,Community,Enrollment,Recreational Classes - Edmonton,Self-disclosing Diverse Students,COMM_REC_Q10,"Did we enrol any self-disclosing diverse students (e.g., newcomers, Indigenous, racialised, low-income, disability) in recreational classes this reporting period in Edmonton?",yes_no,"Yes,No",FALSE,40,inclusion,2,,COM2
Enrollment,Community,Enrollment,Recreational Classes - Edmonton,Self-disclosing Diverse Students,COMM_REC_Q10a,"If yes, how many self-disclosing diverse students enrolled or continued this period?",number,,FALSE,41,inclusion,1,COMM_REC_Q4,COM2
Enrollment,Community,Enrollment,Recreational Classes - Edmonton,Access Barriers for Diverse Students,COMM_REC_Q10b,"If not, what might be limiting access for these students (location, cost, transportation, awareness, cultural barriers)?",text,,FALSE,42,inclusion,1,COMM_REC_Q4=No,COM2
Marketing,Community,Marketing,Recreational Classes - Edmonton,Discounted Performance Tickets for Students,COMM_REC_Q11,Did we offer discounted or sponsored performance tickets to recreational students or their families this reporting period in Edmonton?,yes_no,"Yes,No",FALSE,50,accessibility,2,,COM4
Marketing,Community,Marketing,Recreational Classes - Edmonton,Discounted Performance Tickets for Students,COMM_REC_Q11a,"If yes, how many discounted or sponsored tickets did we provide and to which performances?",text,,FALSE,51,accessibility,1,COMM_REC_Q5,COM4
Marketing,Community,Marketing,Recreational Classes - Edmonton,Ticket Access Channels,COMM_REC_Q11b,"If yes, through which channels or partners were these tickets distributed (schools, community groups, direct to families)?",text,,FALSE,52,accessibility,1,COMM_REC_Q5,COM4
Marketing,Community,Marketing,Recreational Classes - Edmonton,Ticket Access Barriers,COMM_REC_Q11c,"If not, what prevented us from offering discounted or sponsored tickets this period?",text,,FALSE,53,accessibility,1,COMM_REC_Q5=No,COM4
Marketing,Community,Marketing,Recreational Classes - Edmonton,Company Dancer Events with AB Classes,COMM_REC_Q12,"Did we run any company dancer events, in-class experiences, or other special activities with recreational classes this reporting period in Edmonton?",yes_no,"Yes,No",FALSE,60,engagement,2,,COM4
Marketing,Community,Marketing,Recreational Classes - Edmonton,Company Dancer Events with AB Classes,COMM_REC_Q12a,"If yes, what did we do (e.g., dancer visits, backstage experiences, special workshops) and how many students participated?",text,,FALSE,61,engagement,1,COMM_REC_Q6,COM4
Enrollment,Community,AB Classes,Recreational Classes - Calgary,Enrollment Revenue,COMM_REC_FIN_Q1,"The budget for AB Classes in Calgary was $850,349. How much revenue have we generated for AB Classes so far this year (excluding Adults, Summer Programs, and Provincial Affiliates) in Calgary?",number,,FALSE,63,financial,2,,COM2
Enrollment,Community,AB Classes,Recreational Classes - Calgary,Enrollment Revenue,COMM_REC_FIN_Q1a,Explain the variance for AB Classes in Calgary between Budget and Actuals so far this year.,text,,FALSE,64,financial,2,,COM2
Enrollment,Community,AB Classes,Recreational Classes - Calgary,Enrollment Revenue,COMM_REC_FIN_Q1b,"The budget for AB Class Discounts in Calgary was $15,022. How much did we actually give away in discounts AB Classes so far this year in Calgary?",number,,FALSE,65,financial,2,,COM2
Enrollment,Community,AB Classes,Recreational Classes - Calgary,Enrollment Revenue,COMM_REC_FIN_Q1c,Explain the variance for AB Class Discounts in Calgary between Budget and Actuals so far this year.,text,,FALSE,66,financial,2,,COM2
Enrollment,Community,AB Classes,Recreational Classes - Edmonton,Enrollment Revenue,COMM_REC_FIN_Q2,"The budget for AB Classes in Edmonton was $424,302. How much revenue have we generated for AB Classes so far this year (excluding Adults, Summer Programs, and Provincial Affiliates) in Edmonton?",number,,FALSE,67,financial,2,,COM2
Enrollment,Community,AB Classes,Recreational Classes - Edmonton,Enrollment Revenue,COMM_REC_FIN_Q2a,Explain the variance for AB Classes in Edmonton between Budget and Actuals so far this year.,text,,FALSE,68,financial,2,,COM2
Enrollment,Community,AB Classes,Recreational Classes - Edmonton,Enrollment Revenue,COMM_REC_FIN_Q2b,"The budget for AB Class Discounts in Edmonton was $11,968. How much did we actually give away in discounts  B Classes so far this year in Edmonton?",number,,FALSE,69,financial,2,,COM2
Enrollment,Community,AB Classes,Recreational Classes - Edmonton,Enrollment Revenue,COMM_REC_FIN_Q2c,Explain the variance for AB Class Discounts in Edmonton between Budget and Actuals so far this year.,text,,FALSE,70,financial,2,,COM2
Enrollment,Community,Adult Classes,Recreational Classes - Calgary,Enrollment Revenue,COMM_REC_FIN_Q3,"The budget for Adult Classes in Calgary was $108,686. How much revenue have we generated for AB Classes so far this year in Calgary?",number,,FALSE,71,financial,2,,COM2
Enrollment,Community,Adult Classes,Recreational Classes - Calgary,Enrollment Revenue,COMM_REC_FIN_Q3a,Explain the variance for Adult Classes in Calgary between Budget and Actuals so far this year.,text,,FALSE,72,financial,2,,COM2
Enrollment,Community,Adult Classes,Recreational Classes - Edmonton,Enrollment Revenue,COMM_REC_FIN_Q4,"The budget for Adult Classes in Edmonton was $77,770. How much revenue have we generated for AB Classes so far this year in Edmonton?",number,,FALSE,73,financial,2,,COM2
Enrollment,Community,Adult Classes,Recreational Classes - Edmonton,Enrollment Revenue,COMM_REC_FIN_Q4a,Explain the variance for Adult Classes in Edmonton between Budget and Actuals so far this year.,text,,FALSE,74,financial,2,,COM2
Enrollment,Community,Summer Programs,Recreational Classes - Calgary,Enrollment Revenue,COMM_REC_FIN_Q5,"The budget for Summer Classes in Calgary was $70,000. How much revenue have we generated for Summer Classes so far this year in Calgary?",number,,FALSE,75,financial,2,,COM2
Enrollment,Community,Summer Programs,Recreational Classes - Calgary,Enrollment Revenue,COMM_REC_FIN_Q5a,Explain the variance for Summer Classes in Calgary between Budget and Actuals so far this year.,text,,FALSE,76,financial,2,,COM2
Enrollment,Community,Summer Programs,Recreational Classes - Edmonton,Enrollment Revenue,COMM_REC_FIN_Q6,"The budget for Summer Classes in Edmonton was $50,000. How much revenue have we generated for Summer Classes so far this year in Edmonton?",number,,FALSE,77,financial,2,,COM2
Enrollment,Community,Summer Programs,Recreational Classes - Edmonton,Enrollment Revenue,COMM_REC_FIN_Q6a,Explain the variance for Summer Classes in Edmonton between Budget and Actuals so far this year.,text,,FALSE,78,financial,2,,COM2
Enrollment,Community,Summer Programs,Recreational Classes - Provincial,Enrollment Revenue,COMM_REC_FIN_Q7,"The budget for Summer Satellite programs in Alberta was $28,800. How much revenue have we generated for Summer Satellite programs so far this year?",number,,FALSE,79,financial,2,,COM2
Enrollment,Community,Summer Programs,Recreational Classes - Provincial,Enrollment Revenue,COMM_REC_FIN_Q7a,Explain the variance for Summer Satellite programs in Alberta between Budget and Actuals so far this year.,text,,FALSE,80,financial,2,,COM2
Enrollment,Community,Provincial Affiliates,Recreational Classes - Provincial,Enrollment Revenue,COMM_REC_FIN_Q8,"The budget for Provincial Affiliates - South was $48,456. How much revenue have we generated for Provincial Affiliates - South so far this year?",number,,FALSE,81,financial,2,,COM2
Enrollment,Community,Provincial Affiliates,Recreational Classes - Provincial,Enrollment Revenue,COMM_REC_FIN_Q8a,Explain the variance for Provincial Affiliates - South between Budget and Actuals so far this year.,text,,FALSE,82,financial,2,,COM2
Enrollment,Community,Provincial Affiliates,Recreational Classes - Provincial,Enrollment Revenue,COMM_REC_FIN_Q9,"The budget for Provincial Affiliates - North was $29,961. How much revenue have we generated for Provincial Affiliates - South so far this year?",number,,FALSE,83,financial,2,,COM2
Enrollment,Community,Provincial Affiliates,Recreational Classes - Provincial,Enrollment Revenue,COMM_REC_FIN_Q9a,Explain the variance for Provincial Affiliates - North between Budget and Actuals so far this year.,text,,FALSE,84,financial,2,,COM2
